{
  "$schema": "https://json-schema.org/draft/2020-12/schema",
  "type": "object",
  "additionalProperties": false,
  "required": [
    "schema_version",
    "id",
    "version",
    "created_at",
    "supersedes",
    "kind",
    "observed_at",
    "available_at",
    "basis",
    "evidence",
    "source_ref"
  ],
  "properties": {
    "schema_version": {
      "const": 1
    },
    "id": {
      "type": "string",
      "pattern": "^[A-Za-z0-9][A-Za-z0-9_-]*$"
    },
    "version": {
      "type": "integer",
      "minimum": 1
    },
    "created_at": {
      "type": "string",
      "format": "date-time"
    },
    "supersedes": {
      "anyOf": [
        {
          "type": "object",
          "additionalProperties": false,
          "required": [
            "path",
            "kind",
            "id",
            "version",
            "sha256"
          ],
          "properties": {
            "path": {
              "type": "string",
              "minLength": 1
            },
            "kind": {
              "type": "string",
              "minLength": 1
            },
            "id": {
              "type": "string",
              "minLength": 1
            },
            "version": {
              "type": "integer",
              "minimum": 1
            },
            "sha256": {
              "type": "string",
              "pattern": "^[0-9a-f]{64}$"
            }
          }
        },
        {
          "type": "null"
        }
      ]
    },
    "kind": {
      "const": "availability"
    },
    "observed_at": {
      "type": "string",
      "format": "date-time"
    },
    "available_at": {
      "type": "string",
      "format": "date-time"
    },
    "basis": {
      "enum": [
        "contemporaneous_capture",
        "archived_publication"
      ]
    },
    "evidence": {
      "type": "object",
      "additionalProperties": false,
      "required": [
        "path",
        "sha256",
        "media_type"
      ],
      "properties": {
        "path": {
          "type": "string",
          "minLength": 1
        },
        "sha256": {
          "type": "string",
          "pattern": "^[0-9a-f]{64}$"
        },
        "media_type": {
          "enum": [
            "application/json",
            "text/plain",
            "text/x-python"
          ]
        }
      }
    },
    "source_ref": {
      "type": "object",
      "additionalProperties": false,
      "required": [
        "path",
        "kind",
        "id",
        "version",
        "sha256"
      ],
      "properties": {
        "path": {
          "type": "string",
          "minLength": 1
        },
        "kind": {
          "type": "string",
          "minLength": 1
        },
        "id": {
          "type": "string",
          "minLength": 1
        },
        "version": {
          "type": "integer",
          "minimum": 1
        },
        "sha256": {
          "type": "string",
          "pattern": "^[0-9a-f]{64}$"
        }
      }
    }
  }
}
