{"available_at": "2026-09-19T10:00:00Z", "basis": "contemporaneous_capture", "created_at": "2026-09-19T10:00:00Z", "evidence": {"media_type": "application/json", "path": "data/raw/raw.json", "sha256": "f4e3fd0f3e5089925a3be5ca4ca6bda5ae7458159b32b1615c22ccaba8b005d9"}, "id": "AV", "kind": "availability", "observed_at": "2026-09-19T10:00:00Z", "schema_version": 1, "source_ref": {"id": "SRC", "kind": "source", "path": "data/sources/SRC.v1.json", "sha256": "843b0794bf06d4ba37a6f5c01d09efdbb40edfc84e0311cc1f917c50c8f0d351", "version": 1}, "supersedes": null, "version": 1}